UserID,AnimeID,Name,Genre,Type,EpisodeCount,Rating,ImageURL,time_of_day,purchase_history,Tags
449,27629,Tantei Kageki Milky Holmes TD,Comedy Mystery Super Power,TV,12,6.47,https://cdn.myanimelist.net/images/anime/3/21562.jpg,3,5,"milky, comedy, kageki, mystery, td, holmes, super, tv, power, tantei"
155,31268,Miira no Yume,Dementia,Movie,1,2.97,https://cdn.myanimelist.net/images/anime/3/13506.jpg,3,5,"miira, movie, dementia, yume"
475,16259,Inferious Wakusei Senshi Gaiden Condition Green,Action Sci-Fi,OVA,6,6.08,https://m.media-amazon.com/images/M/MV5BMTYwMDczMzMwNV5BMl5BanBnXkFtZTYwODAzNTg4._V1_.jpg,3,5,"gaiden, green, inferious, senshi, ova, action, condition, wakusei"
466,846,School Rumble Ni Gakki,Comedy Romance School Shounen,TV,26,8.15,https://somoskudasai.com/wp-content/uploads/2020/12/orphan_2nd_main.jpg,3,5,"comedy, gakki, school, ni, romance, shounen, tv, rumble"
290,33377,Trickster: Edogawa Ranpo &quot;Shounen Tanteidan&quot; yori,Mystery,TV,24,6.64,https://www.reddit.com/media?url=https%3A%2F%2Fi.redd.it%2F7ijpsr4190z51.jpg&rdt=56810,3,5,"trickster, mystery, ranpo, edogawa, tanteidan, yori, quot, shounen, tv"
32,9724,Break Blade 5: Shisen no Hate,Action Mecha Military Shounen,Movie,1,7.96,https://i.pinimg.com/originals/29/62/67/29626763b80f4a027c895a8ccdb2900c.png,3,5,"hate, shisen, movie, mecha, blade, military, action, shounen, break"
305,8754,Tales of the Abyss Special Fan Disc,Comedy Slice of Life,Special,2,6.89,"https://m.media-amazon.com/images/M/MV5BMGQzYjFhMTgtY2Q4Yy00MDlmLTk3ZTItYTI1NjBiZjZmNGY2XkEyXkFqcGdeQXVyNTcyNTg3Nzc@._V1_UY1200_CR105,0,630,1200_AL_.jpg",3,5,"tales, comedy, slice, abyss, fan, disc, special, life"
99,31741,Magi: Sinbad no Bouken (TV),Action Adventure Fantasy Magic Shounen,TV,13,8.22,https://cdn.myanimelist.net/images/anime/13/47891l.jpg,3,5,"bouken, adventure, magic, sinbad, magi, shounen, tv, action, fantasy"
90,29731,Beppu x Peeping Life,Comedy Slice of Life,ONA,1,5.21,https://cdn.myanimelist.net/images/anime/5/4277.jpg,3,5,"comedy, x, ona, peeping, slice, beppu, life"
317,8494,Kikansha Yaemon: D51 no Daibouken,Fantasy Kids,Movie,1,5.31,https://www.myutaku.com/media/anime/poster/315x210/75112.jpg,3,5,"yaemon, kikansha, movie, kids, daibouken, fantasy"
